{
  "cidr": "10.42.0.0/16",
  "dhcp_domain_name": "svc.usekarma.local",
  "az_count": 2,
  "enable_ssm_endpoints": true,
  "single_nat_gateway": true,
  "default_sg_allow_self": false,
  "default_sg_extra_ingress_cidrs": ["203.0.113.42/32"],
  "tags": {
    "Environment": "prod",
    "Project": "usekarma",
    "Owner": "team"
  }
}
